title,acronym
International Conference on Network Protocols,ICNP
International Conference on Computing and Informatics,ICOCI
International Conference on Neural Information Processing,ICONIP
International Conference on Operations Research and Enterprise Systems,ICORES
IEEE International Conference on Program Comprehension,ICPC
ACM/SPEC International Conference on Performance Engineering,ICPE
International Conference on Process Mining,ICPM
International Conference on Parallel Processing,ICPP
International Conference on Pattern Recognition,ICPR
International Conference on Pattern Recognition Applications and Methods,ICPRAM
IEEE International Conference on Robotics and Automation,ICRA
ACM International Conference on Supercomputing,ICS
International Conference on Software Architecture,ICSA
International Conference on Software Engineering,ICSE
International Conference on Software Engineering Advances,ICSEA
International Conference on Systems Engineering,ICSEng
IEEE International Conference on Software Maintenance and Evolution,ICSME
International Conference on Service Oriented Computing,ICSOC
International Conference on Software and Data Technologies,ICSoft
International Conference on Software Reuse,ICSR
International Conference on Software and System Processes,ICSSP
"International Conference on Software Testing, Verification and Validation",ICST
International Conference on Information and Communication Technologies for Ageing Well and e-Health,ICT4AWE
International Colloquium on Theoretical Aspects of Computing,ICTAC
International Conference on Tools with Artificial Intelligence,ICTAI
International Conference on Information and Communication Technologies and Development,ICTD
"ICT in Education, Research, and Industrial Applications",ICTERI
International Conference on the Theory of Information Retrieval,ICTIR
International Conference on Testing Software and Systems,ICTSS
International Conference on Virtual Rehabilitation,ICVR
International Conference on Web Engineering,ICWE
IEEE International Conference on Web Services,ICWS
International Conference on Web and Social Media,ICWSM
Intelligent Data Analysis,IDA
Intelligent Distributed Computing,IDC
Interaction Design and Children,IDC
International Conference on Informatics & Data-Driven Medicine,IDDM
International Database Engineering and Applications Symposium,IDEAS
The International Conference on Intelligent Environments,IE
Interactive Entertainment,IE
International Conference on Industrial and Engineering Applications of Artificial Intelligence and Expert Systems,IEA/AIE
IEEE Industrial Electronics Society,IECON
IEEE International Symposium on Artificial Life,IEEE Alife
IEEE Consumer Communications and Networking Conference,IEEE CCNC
IEEE Symposium on Computational Intelligence for Financial Engineering,IEEE CIFEr
IEEE Symposium on Computational intelligence for Multimedia Signal and Vision Processing,IEEE CIMSIVP
IEEE Symposium on Computational Intelligence for Security and Defence Applications,IEEE CISDA
IEEE International Conference on Intelligent Systems,IEEE IS
IEEE Visualization,IEEE VIS
Intelligent Vehicles Conference,IEEE-IV
Intenational Environmental Modelling and Software Society,iEMSs
IFIP Information Security & Privacy Conference,IFIP SEC
Integrated Formal Methods,IFM
IFSA World Congress,IFSA
IEEE International Geoscience and Remote Sensing Symposium,IGARSS
Information Hiding and Multimedia Security Workshop,IH&MMSec
Information Integration and Web-based Applications and Services,IIWAS
International Joint Conference on Artificial Intelligence,IJCAI
International Joint Conference on Automated Reasoning,IJCAR
International Joint Conference on Biometrics,IJCB
International Joint Conference on Computational Intelligence,IJCCI
International Joint Conference on Natural Language Processing,IJCNLP
IEEE International Joint Conference on Neural Networks,IJCNN
International Conference on Information and Knowledge Engineering,IKE
Inductive Logic Programming,ILP
Internet Measurement Conference,IMC
International Machine Vision and Image Processing Conference,IMVIP
Indian Conference on Human-Computer Interaction,IndiaHCI
IEEE International Conference on Industrial Informatics,INDIN
International Conference on Cryptology in India,INDOCRYPT
IEEE International Conference on Computer Communications,INFOCOM
International Conference on Advanced Communications and Computation,INFOCOMP
IEEE International Scientific Conference on Informatics,Informatics
Information Visualisation Theory and Practice,InfVis
International Symposium on Innovations in Intelligent Systems and Applications,INISTA
International Natural Language Generation Conference,INLG
International Network Optimization Conference,INOC
SKLOIS Conference on Information Security and Cryptology,Inscrypt
Informing Science and Information Technology Education,InSITE
Interspeech,Interspeech
IEEE International On-Line Testing Symposium,IOLTS
"International Conference on Internet of Things, Big Data and Security",IoTBDS
IEEE International Performance Computing and Communications Conference,IPCCC
Conference on Integer Programming and Combinatorial Optimization,IPCO
IEEE International Parallel and Distributed Processing Symposium,IPDPS
International Symposium on Parameterized and Exact Computation,IPEC
International Conference on Indoor Positioning and Indoor Navigation,IPIN
International Conference on Information Processing and Management of Uncertainty,IPMU
Information Processing in Sensor Networks,IPSN
IEEE International Conference on Information Reuse and Integration,IRI
IEEE/RSJ International Conference on Intelligent Robots and Systems,IROS
International Symposium on Algorithms and Computation,ISAAC
International Symposium on Autonomous Decentralized Systems,ISADS
Conference for the International Simulation and Gaming Association,ISAGA
International Symposium on Artificial Intelligence and Mathematics,ISAIM
International Symposium on Automation and Robotics in Construction,ISARC
Industrial Simulation Conference,ISC
Information Security Conference,ISC
ISC High Performance,ISC
IEEE International Symposium on Circuits and Systems,ISCAS
IEEE Symposium on Computers and Communications,ISCC
International Symposium on Combinatorial Optimisation,ISCO
International Conference on Intelligent Systems Designs and Applications,ISDA
International Symposium on Grids and Clouds,ISGC
IEEE International Conference on Intelligence and Security Informatics,ISI
IEEE International Symposium on Information Theory,ISIT
International Symposium on Information Theory and Its Applications,ISITA
International Conference on Intelligent Systems and Knowledge Engineering,ISKE
IEEE International Symposium on Multimedia,ISM
IEEE/ACM International Symposium on Mixed and Augmented Reality,ISMAR
Intelligent Systems in Molecular Biology,ISMB
International Symposium on Foundations of Intelligent Systems,ISMIS
International Symposium on Memory Management,ISMM
"International Symposium on Networks, Computers and Communications",ISNCC
International Symposium on Neural Networks,ISNN
"International Symposium on Leveraging Applications of Formal Methods, Verification and Validation",ISoLA
IEEE International Symposium on Real-Time Distributed Computing,ISORC
IEEE International Symposium on Parallel and Distributed Processing with Applications,ISPA
IEEE International Symposium on Performance Analysis of Systems and Software,ISPASS
International Symposium on Parallel and Distributed Computing,ISPDC
Information Security Practice and Experience Conference,ISPEC
ACM International Conference on Interactive Surfaces and Spaces,ISS
International Symposium on Symbolic and Algebraic Computation,ISSAC
International Symposium on Software Reliability Engineering,ISSRE
International Symposium on Software Testing and Analysis,ISSTA
International Symposium on Technology and Society,ISTAS
International Symposium on Visual Computing,ISVC
International Semantic Web Conference,ISWC
IEEE International Symposium on Wearable Computers,ISWC
International Conference on Internet Technologies and Applications,ITA
International Teletraffic Congress,ITC
IEEE International Test Conference,ITC
Innovations in Theoretical Computer Science,ITCS
Annual Conference on Innovation and Technology in Computer Science Education,ITiCSE
International Telecommunication Networks and Applications Conference,ITNAC
Conference on Interactive Theorem Proving,ITP
International Conference on Intelligent Tutoring Systems,ITS
Information Theory Workshop,ITW
International Conference on Intelligent User Interfaces,IUI
International Conference on Information Visualisation,IV
Intelligent Virtual Agents,IVA
Applications of Information Visualization,IV-App
Image and Vision Computing Conference,IVCNZ
International Work-Conference on Artificial and Natural Neural Networks,IWANN
International Workshop on Combinatorial Image Analysis: Theory and Applications,IWCIA
ACM International Wireless Communications and Mobile Computing Conference,IWCMC
International Work-conference on the Interplay between Natural and Artificial Computation,IWINAC
International Workshop on Combinatorial Algorithm,IWOCA
IEEE International Workshop on Quality of Service,IWQoS
International Workshop on Security,IWSEC
Joint Conference of the International Workshop on Software Measurement and the International Conference on Software Process and Product Measurement,IWSM Mensura
International Conference on the Statistical Analysis of Textual Data,JADT
"Logics in Artificial Intelligence, European Conference",JELIA
Workshop on Job Scheduling Strategies for Parallel Processing,JSSPP
International Conference on Legal Knowledge and Information Systems,JURIX
Knowledge capture,K-CAP
ACM International Conference on Knowledge Discovery and Data Mining,KDD
International Conference on Knowledge Engineering and Ontology Development,KEOD
International Conference on Knowledge-Based and Intelligent Information and Engineering Systems,KES
International KES Conference on Agents and Multiagent systems - Technologies and Applications,KES AMSTA
KES International Symposium on Intelligent Decision Technologies,KES IDT
International Conference on the Principles of Knowledge Representation and Reasoning,KR
"International Conference on Knowledge Science, Engineering and Management",KSEM
Knowledge Visualization and Visual Thinking,KV
"Latin-American Algorithms, Graphs and Optimization Symposium",LAGOS
International Conference on Learning Analytics and Knowledge,LAK
IEEE LAN/MAN Workshop,LANMAN
International Symposium on Latin American Theoretical Informatics,LATIN
IEEE Conference on Local Computer Networks,LCN
"ACM SIGPLAN Conference on Languages, Compilers and Tools for Embedded Systems",LCTES
"Language, Data and Knowledge",LDK
IEEE Symposium on Logic in Computer Science,LICS
International Symposium on Logic-based Program Synthesis and Transformation,LOPSTR
Logic Programming and Automated Reasoning,LPAR
International Conference on Logic Programming and Non-monotonic Reasoning,LPNMR
Language Resources and Evaluation Conference,LREC
International Workshop on MultiAgent Based Simulation,MABS
Symposium Model Analysis and Simulation of Computer and Telecommunications Systems,MASCOTS
IEEE International Conference on Mobile Ad-hoc and Sensor Systems,MASS
"Machines, Computations and Universality",MCU
International Conference on Modelling Decisions for Artificial Intelligence,MDAI
International Conference on Mobile Data Management,MDM
International Conference on Management of Digital EcoSystems,MEDES
International Conference on Model and Data Engineering,MEDI
International Conference on Formal Methods and Models for Co-Design,MEMOCODE
International Symposium on Mathematical Foundations of Computer Science,MFCS
International Conference on Mathematical Foundations of Programming Semantics,MFPS
Malaysia International Conference on Communications,MICC
Medical Image Computing and Computer-Assisted Intervention,MICCAI
International Symposium on Microarchitecture,MICRO
ACM/IFIP/USENIX International Middleware Conference,Middleware
International Conference in Methodologies and Intelligent Systems for Technology Enhanced Learning,MIS4TEL
International Workshop on Modelling in Software Engineering,MISE
International Conference on Methods and Models in Automation and Robotics,MMAR
International Conference on Multimedia Modelling,MMM
International Workshop on Multimedia Signal Processing,MMSP
ACM International Conference on Mobile Computing and Networking,MOBICOM
ACM Symposium on Mobile Ad Hoc Networking and Computing,MOBIHOC
International Conference on Human-Computer Interaction with Mobile Devices and Services,MobileHCI
International Conference on Mobile and Ubiquitous Systems: Networks and Services,Mobiquitous
International Conference on Mobile Systems and Pervasive Computing,MobiSPC
"ACM SIGMOBILE International Conference on Mobile Systems, Applications and Services",Mobisys
International Conference on Model Driven Engineering Languages and Systems,MODELS
International Conference on Model-Driven Engineering and Software Development,MODELSWARD
International Congress on Modelling and Simulation,MODSIM
International Conference on Advances in Mobile Computing and Multimedia,MOMM
Modelling and Optimization: Theory and Applications,MOPTA
International Conference on Managed Programming Languages and Runtimes,MPLR
IEEE International Working Conference on Mining Software Repositories,MSR
IEEE Conference on Mass Storage Systems and Technologies,MSST
"ACM/IEEE International Conference on Modelling, Analysis and Simulation of Wireless and Mobile Systems",MSWIM
Machine Translation Summit,MT SUMMIT
International Symposium on the Mathematical Theory of Networks and Systems,MTNS
Mensch & Computer,MuC
Mobile and Ubiquitous Multimedia,MUM
Machine Vision Applications,MVA
North American Association for Computational Linguistics,NAACL
IEEE International Symposium on Network Computing and Applications,NCA
Usenix Network and Distributed System Security Symposium,NDSS
International Conference on Network Softwarization,NetSoft
IFIP International Conference on Networking,Networking
Advances in Neural Information Processing Systems,NeurIPS
Applications of Natural Language to Data Bases,NLDB
IEEE Network Operations and Management Symposium,NOMS
Nordic Conference on Human-Computer Interaction,NordiCHI
Network and Operating System Support for Digital Audio and Video,NOSSDAV
IFIP International Conference on Network and Parallel Computing,NPC
"Symposium on Networked Systems, Design and Implementation",NSDI
New Security Paradigms Workshop,NSPW
International Conference on network and System Security,NSS
New Zealand Game Developers Conference,NZGDC
"International Symposium on New Ideas, New Paradigms, and Reflections on Programming and Software",Onward
ACM Conference on Object Oriented Programming Systems Languages and Applications,OOPSLA
SIAM Conference on Optimization,OP
International Conference on Principles of Distributed Systems,OPODIS
Usenix Symposium on Operating Systems Design and Implementation,OSDI
Australian Computer Human Interaction Conference,OZCHI
Practical Applications of Agents and Multiagent Systems,PAAMS
International Conference on Practical Applications of Computational Biology & Bioinformatics,PACBB
IEEE Pacific Visualization Symposium,PacificVis
"Pacific Asia Conference on Language, Information and Computation",PACLIC
International Conference on Parallel Architecture and Compilation Techniques,PACT
Practical Aspects of Declarative Languages,PADL
Pacific-Asia Conference on Knowledge Discovery and Data Mining,PAKDD
Passive and Active Measurement Conference,PAM
Practice and Theory of Automated Timetabling,PATAT
International Picture Coding Symposium,PCS
"International Conference on Parallel and Distributed Computing, Applications and Technologies",PDCAT
"Euromicro International Conference on Parallel, Distributed and Network Based Processing",PDP
International Conference on Parallel and Distributed Processing Techniques and Applications,PDPTA
IFIP/IEEE International Conference on Performance Evaluation and Modeling in Wired and Wireless Networks,PEMWN
ACM SIGPLAN Workshop on Partial Evaluation and Program Manipulation,PEPM
IEEE International Conference on Pervasive Computing and Communications,PERCOM
"IFIP International Symposium on Computing Performance, Modelling, Measurement and Evaluation",PERFORMANCE
International Conference on the Application and Theory of Petri Nets and Concurrency,Petri Nets
Privacy Enhancing Technologies Symposium,PETS
Pacific Conference on Computer Graphics and Applications,PG
IEEE International Symposium on Personal and Indoor Mobile Radio Conference,PIMRC
Pacific Rim Knowledge Acquisition Workshop,PKAW
International Conference on Practice and Theory in Public Key Cryptography,PKC
ACM-SIGPLAN Conference on Programming Language Design and Implementation,PLDI
Pattern Languages of Programs,PLOP
Workshop on Programming Languages and Operating Systems,PLOS
ACM Symposium on Principles of Distributed Computing,PODC
ACM SIGMOD-SIGACT-SIGART Conference on Principles of Database Systems,PODS
IFIP WG8.1 Working Conference on the Practice of Enterprise Modeling,PoEM
ACM-SIGACT Symposium on Principles of Programming Languages,POPL
International Conference on Parallel Processing and Applied Mathematics,PPAM
International Conference on Principles and Practice of Declarative Programming,PPDP
Principles and Practice of Parallel Programming,PPoPP
Parallel Problem Solving from Nature,PPSN
International Workshop on Post-Quantum Cryptography,PQCrypto
Pacific Rim International Symposium on Dependable Computing,PRDC
Pacific Rim International Conference on Artificial Intelligence,PRICAI
International Conference on Principles of Practice in Multi-Agent Systems,PRIMA
Product Focused Software Process Improvement,PROFES
IFIP Working Conferences on Virtual Enterprises,PRO-VE
International Conference on Provable Security,ProvSec
Pacific Symposium on Biocomputing,PSB
Prague Stringology Conference,PSC
Privacy in Statistical Databases,PSD
"Annual Conference on Privacy, Security and Trust",PST
IEEE International Conference on Quantum Computing and Engineering,QCE
International Conference on Quality of Multimedia Experience,QoMEX
"Software Quality, Reliability, and Security",QRS
"International Conference on Heterogeneous Networking for Quality, Reliability, Security and Robustness",Qshine
International Conference on the Quality of Information and Communications Technology,QUATIC
"The International Symposium on Research in Attacks, Intrusions and Defenses",RAID
International Conference on Relational and AlgebraicMethods in Computer Science,RAMiCS
International Conference on Recent Advances in Natural Language Processing,RANLP
International Conference on Reversible Computation,RC
International Conference on Research Challenges in Information Science,RCIS
IEEE International Requirements Engineering Conference,RE
International Conference on Computational Molecular Biology,RECOMB
ACM International Conference on Recommender Systems,RecSys
International Symposium 'Problems of Redundancy in Information and Control Systems',Redundancy
International Workshop on Requirements Engineering: Foundation for Software Quality,REFSQ
Robot Soccer World Cup,RoboCup
"International Conference on Robotics, Vision, Signal Processing and Power Applications",RoVISP
IEEE International Symposium on Rapid System Prototyping,RSP
Robotics: Science and Systems,RSS
IEEE Real-Time and Embedded Technology and Applications Symposium,RTAS
International Conference on Embedded and Real Time Computing Systems and Applications,RTCSA
International Conference on Real-Time and Network Systems,RTNS
Real Time Systems Symposium,RTSS
International Joint Conference on Rules and Reasoning,RuleML+RR
International Conference on Runtime Verification,RV
ACM Symposium on Applied Computing,SAC
Selected Areas in Cryptography,SAC
International Symposium on Applied Computational Intelligence and Informatics,SACI
ACM Symposium on Access Control Models and Technologies,SACMAT
"International Conference on Computer Safety, Reliability and Security",SAFECOMP
"IFAC Symposium on Fault Detection, Supervision and Safety of Technical Processes",SAFEProcess
International Symposium on Algorithmic Game Theory,SAGT
International Symposium on Applied Machine Intelligence and Informatics,SAMI
"IEEE International Conference on Software Analysis, Evolution and Reengineering",SANER
Static Analysis Symposium,SAS
Simulation and Synthesis in Medical Imaging,SASHIMI
International Conference on Theory and Applications of Satisfiability Testing,SAT
International Symposium on Computer Architecture and High Performance Computing,SBAC-PAD
"International Conference for High Performance Computing, Networking, Storage and Analysis",SC
ACM SIGGRAPH/Eurographics Symposium on Computer Animation,SCA
IEEE International Working Conference on Source Code Analysis and Manipulation,SCAM
Conference on Security and Cryptography for Networks,SCN
International Workshop on Software and Compilers for Embedded Systems,SCOPES
SIAM International Conference on Data Mining,SDM
International Symposium on Experimental Algorithms,SEA
Euromicro Conference on Software Engineering and Advanced Applications,SEAA
International Symposium on Software Engineering for Adaptive and Self-Managing Systems,SEAMS
ACM/IEEE Symposium on Edge Computing,SEC
"IEEE International Conference on Sensing, Communication and Networking",SECON
International Conference on Information Security and Cryptography,SECRYPT
International Conference on Security and Privacy for Communication Networks,SecureComm
International Conference on Software Engineering and Formal Methods,SEFM
International Conference on Sustainable Energy Information Technology,SEIT
International Conference on Software Engineering and Knowledge Engineering,SEKE
ACM Conference on Embedded Networked Sensor Systems,SENSYS
"ACIS Conference on Software Engineering Research, Management and Applications",SERA
IEEE Congress on Services,SERVICES
International Conference on Sequences and their Applications,SETA
"International Symposium on Software Engineering: Theories, Tools, and Applications",SETTA
SGAI International Conference on Artificial Intelligence,SGAI
Symposium on Geometry Processing,SGP
"ACM Conference on Applications, Technologies, Architectures, and Protocols for Computer Communication",SIGCOMM
ACM Special Interest Group on Computer Science Education Conference,SIGCSE
Annual Meeting of the Special Interest Group on Discourse and Dialog,SIGdial
ACM SIG International Conference on Computer Graphics and Interactive Techniques,SIGGRAPH
SIGGRAPH Asia,SiggraphA
ACM International Conference on Research and Development in Information Retrieval,SIGIR
ACM Information Technology Education,SIGITE
Measurement and Modeling of Computer Systems,SIGMETRICS
ACM Special Interest Group on Management of Data Conference,SIGMOD
ACM International Conference on Advances in Geographic Information Systems,SIGSPATIAL
ACM SIGUCCS Conference on User Services,SIGUCCS
Simulation Technology and Training Conference,SimTecT
International Conference on Security of Information and Networks,SIN
International Colloquium on Structural Information and Communication Complexity,SIROCCO
International Conference on Similarity Search and Applications,SISAP
International Symposium on Intelligent Systems and Informatics,SISY
International Conference on Software Language Engineering,SLE
"IEEE Conference on Systems, Man and Cybernetics",SMC
"International Conference on Software Engineering, Artificial Intelligence, Networking and Parallel/Distributed Computing",SNPD
International Symposium on Computational Geometry,SoCG
The Symposium of Combinatorial Search,SoCS
ACM/SIAM Symposium on Discrete Algorithms,SODA
Current Trends in Theory and Practice of Computer Science,SOFSEM
Conference on Software in Telecommunications and Computer Networks,SOFTCOM
"International Conference on Intelligent Software Methodologies, Tools, and Techniques",SoMeT
ACM SIGOPS Symposium on Operating Systems Principles,SOSP
Symposium On Usable Privacy and Security,SOUPS
IEEE Symposium on Security and Privacy,SP
Symposium on Parallelism in Algorithms and Architectures,SPAA
Software Process Improvement and Capability Determination,SPICE
International Symposium on String Processing and Information Retrieval,SPIRE
Software Product Lines Conference,SPLC
ACM Symposium on Solid and Physical Modelling,SPM
International Conference on Software Quality Management,SQM
International Symposium on Search Based Software Engineering,SSBSE
International Conference on Scientific and Statistical Data Base Management,SSDBM
Structural and Syntactical Pattern Recognition,SSPR
"Symposium on Stabilization, Safety, and Security of Distributed Systems",SSS
IFAC Conference on System Structure and Control,SSSC
Australasian Speech Science and Technology,SST
International Symposium on Spatial and Temporal Databases,SSTD
International Symposium on Theoretical Aspects of Computer Science,STACS
ACM Symposium on Theory of Computing,STOC
International Symposium on Symbolic and Numeric Algorithms for Scientific Computing,SYNASC
The ACM International System and Storage Conference,SYSTOR
Tools and Algorithms for Construction and Analysis of Systems,TACAS
Conference on Theory and Applications of Models of Computation,TAMC
International Conference on Tests and Proofs,TAP
Richard Tapia Celebration of Diversity in Computing Conference,Tapia
Theoretical Aspects of Rationality and Knowledge,TARK
International Symposium on Theoretical Aspects of Software Engineering,TASE
Theory of Cryptography Conference,TCC
International Conference on Technical Debt,TechDebt
"Tangible, Embedded, and Embodied Interaction",TEI
IEEE Region 10 Conference,Tencon
International Symposium on Temporal Representation and Reasoning,TIME
International Conference on Theory and Practice of Digital Libraries,TPDL
