title,acronym
"International Conference on Trust, Security and Privacy in Computing and Communications",TrustCom
Conference in Uncertainty in Artificial Intelligence,UAI
"International Conference on Mobile Ubiquitous Computing, Systems, Services and Technologies",UBICOMM
ACM International Joint Conference on Pervasive and Ubiquitous Computing,UbiComp
International Conference on Unconventional Computation and Natural Computation,UC
Utility and Cloud Computing,UCC
International Conference on Ubiquitous Intelligence and Computing,UIC
ACM Symposium on User Interface Software and Technology,UIST
"International Conference on User Modelling, Adaptation, and Personalization",UMAP
Usable Security and Privacy,USEC
Usenix Annual Technical Conference,USENIX
Usenix Security Symposium,USENIX-Security
IEEE International Conference on Visual Communications and Image Processing,VCIP
Conference on Visualization and Data Analysis,VDA
The International Conference on Verification and Evaluation of Computer and Communication Systems,VECoS
International Conference on Vehicle Technology and Intelligent Transport Systems,VEHITS
Visual Information Communication and Interaction,VINCI
"Joint Conference on Computer Vision, Imaging and Computer Graphics Theory and Applications",VISIGRAPP
IEEE International Working Conference on Software Visualisation,VISSOFT
IEEE Symposium on Visual Languages and Human-Centric Computing,VL/HCC
International Conference on Very Large Databases,VLDB
International Conference on VLSI Design,VLSID
"Verification, Model Checking and Abstract Interpretation",VMCAI
IEEE Conference on Virtual Reality and 3D User Interfaces,VR
ACM Virtual Reality Software and Technology,VRST
IEEE Vehicular Technology Conference,VTC
IEEE VLSI Test Symposium,VTS
International Workshop on Web and Wireless Geographical Information Systems,W2GIS
Workshop on Algorithms in Bioinformatics,WABI
IEEE Workshop on Applications of Computer Vision,WACV
International Workshop on the Algorithmic Foundations of Robotics,WAFR
Workshop on the Arithmetic of Finite Fields,WAIFI
International Conference and Workshops on Algorithms and Computation,WALCOM
Workshop on Approximation and Online Algorithms,WAOA
Workshop on Algorithms And Models For The Web Graph,WAW
Workshop on Computer Architecture Education,WCAE
IEEE Wireless Communications and Networking Conference,WCNC
Workshop on Computational Optimization,WCO
International Conference on Web Information Systems and Technologies,WEBIST
International Workshops on Enabling Technologies: Infrastructures for Collaborative Enterprises,WETICE
International Workshop on Graph-Theoretic Concepts in Computer Science,WG
IEEE/WIC/ACM International Conference on Web Intelligence,WI
"IEEE International Conference on Wireless and Mobile Computing, Networking and Communications",WiMob
International Conference on Wireless Networks and Mobile Communications,WINCOM
"International Symposium on Modelling and Optimization in Mobile, Ad Hoc, and Wireless Networks",WiOpt
International Workshop on Information Security Applications,WISA
International Conference on Web Information Systems Engineering,WISE
"World Multi-Conference on Systemics, Cybernetics and Informatics",WMSCI
"Workshop on Logic, Language, Information and Computation",WoLLIC
World Conference on Information Systems and Technologies,WorldCIST
"World Congress in Computer Science, Computer Engineering, and Applied Computing",WORLDCOMP
"International Conferences in Central Europe on Computer Graphics, Visualization and Computer Vision",WSCG
ACM International Conference on Web Search and Data Mining,WSDM
International World Wide Web Conference,WWW
Conference on Agile Software Development,XP
International Workshop on Algebraic and Combinatorial Coding Theory,ACCT
Asian Conference on Computer Vision,ACCV
"ACM International Conference on Advances in Computer Entertainment (merged with DIMEA, Digital Interactive Media in Entertainment and Arts, in 2009)",ACE
Australasian Document Computing Symposium,ADCS
Australian Institute of Computer Ethics Conference,AICE
Asia-Pacific Bioinformatics Conference,APBC
Asia-Pacific Conference on Conceptual Modelling,APCCM
Asia-Pacific Services Computing Conference,APSCC
National Conference of The Australian Society for Operations Research,ASOR
IberoAmerican Congress on Pattern Recognition,CIARP
IEEE Symposium on Computational Intelligence and Data Mining,CIDM
International Workshop on Combinations of Intelligent Methods and Applications,CIMA
Conference on Combinatorial Optimization and Applications,COCOA
Conference on Robot Learning,CoRL
ACM Conference on Computer Supported Cooperative Work,CSCW
International CSI Computer Conference,CSICC
International Computer Science Symposium in Russia,CSR
Cologne-Twente Workshop on Graphs and Combinatorial Optimization,CTW
IFIP International Conference on Distributed Applications and Interoperable Systems,DAIS
The Theory and Application of Diagrams,DIAGRAMS
Dynamic Languages Symposium,DLS
SIAM Conference on Discrete Mathematics,DM
IEEE International Conference on Data Science and Advanced Analytics,DSAA
Workshop on Domain Specific Modelling,DSM
European Chapter on Combinatorial Optimization,ECCO
European Conference on Computer Supported Cooperative Work,ECSCW
"World Conference on Educational Multimedia, Hypermedia and Telecommunications ",ED-MEDIA
Engineering Interactive Computing Systems,EICS
"EuroConference on Combinatorics, Graph Theory and Applications",EUroComb
Visual Analytics,EuroVA
International Conference on Applications of Evolutionary Computation,EvoApplications
International Frontiers of Algorithmics Workshop,FAW
International FLINS Conference on Robotics and Artificial Intelligence (was International Fuzzy Logic and Intelligent technologies in Nuclear Science Conference),FLINS
International Conference on Hybrid Intelligent Systems,HIS
"International Conference on Control, Automation, Robotics and Vision",ICARCV
International Congress on Computational and Applied Mathematics,ICCAM
IEEE International Conference on Cognitive Informatics,ICCI
International Conference on Communication Systems and Applications,ICCSA
International Conference on Distributed Computing and Internet Technologies,ICDCIT
International Conference Formal Concept Analysis Conference,ICFCA
International Conference on Frontiers of Handwriting Recognition,ICFHR
IEEE International Conference on Global Software Engineering,ICGSE
International Conference on Internet Computing in Science and Engineering,ICICSE
International Conference on Smart homes and health Telematics,ICOST
International Conference on Optimization: Techniques And Applications,ICOTA
International Conference on Parallel and Distributed Systems,ICPADS
International Conference on Computer Vision Systems,ICVS
International Conference on Intelligent Data Engineering and Automated Learning,IDEAL
IEEE International Symposium on Adaptive Dynamic Programming and Reinforcement Learning,IEEE ADPRL
IEEE Symposium on Computational Intelligence in Control and Automation,IEEE CICA
IEEE Symposium on Computational Intelligence in Cyber Security,IEEE CICS
IEEE Swarm Intelligence Symposium,IEEE SIS
IEEE International Conference on Software Services Engineering (previously IEEE International Conference on Services Computing SCC),IEEE SSE
Asia Pacific Symposium on Intelligent and Evolutionary Systems (was Australia-Japan Joint Workshop on  Intelligent and Evolutionary Systems),IES
International Joint Conference on Rough Sets (2014 International Conference on Rough Sets and Current Trends in Computing joined with 3 others),IJCRS (was RSCTC)
International Conference of the Immersive Learning Research Network,iLRN
IFIP/IEEE International Symposium on Integrated Management (even years sharing with NOMS),IM
IMA International Conference on Cryptography and Coding,IMACC
IFIP TC13 Conference on Human-Computer Interaction,Interact
ACM International Symposium on Computer Architecture,ISCA
Annual International Workshop on Presence,ISPR
International Symposium on Robotics Research,ISRR
International Symposium on Spatial Data Quality,ISSDQ
International Symposium on Ubiquitous Virtual Reality,ISUVR
Information Visualization in Biomedical Informatics,IVBI
International Workshop on Digital Watermarking,IWDW
Knowledge Domain Visualisation,KDViz
International Conference on Language and Automata Theory and Applications,LATA
Logical Foundations of Computer Science,LFCS
Multimedia and Network Information Systems,MISSI
Mathematics of Program Construction,MPC
International Symposium on Open Collaboration (was International Symposiums on Wikis),OPENSYM
ACM SIGSIM Conference on Principles of Advanced Discrete Simulation (was Parallel and Distributed Simulation),PADS
International Conference on Pairing-based Cryptography,Pairing
Pacific-Rim Symposium on Image and Video Technology,PSIVT
International Symposium on Spatial Data Handling,SDH
Semantics - International Conference on Semantic Systems,Semantics
"International Conference: Sciences of Electronics, Technologies of information and Telecommunication",SETIT
IEEE Software Engineering Workshop,SEW
International Workshop on Soft Computing Applications,SOFA
Symposium on Reliable Distributed Systems,SRDS
International Conference on Theorem Proving with Analytic Tableaux and Related Methods,TABLEAUX
International Visualization in Transportation Symposium,TRB
Testbeds and Research Infrastructures for the Development of Networks and Communities,TridentCom
"International Conference on Trust, Privacy and Security in Digital Business",TrustBus
International Conference on Virtual Execution Environments,VEE
International Workshop on Visualization for Cyber Security,VizSec
Algorithms and Data Structures Symposium (was Workshop on Algorithms and Data Structures),WADS
Workshop in Information Security Theory and Practices,WISTP
"IEEE International Symposium on a World of Wireless, Mobile and Multimedia Networks",WoWMoM
Winter Simulation Conference,WSC
